{"$schema":"https://json-schema.org/draft/2020-12/schema","$id":"https://jichi-insight.example/schemas/kagawa_extended_plan_indicator_evidence.schema.json","title":"Kagawa extended plan indicator evidence","type":"object","additionalProperties":false,"required":["id","prefecture_code","packet_count","packets","updated_at"],"properties":{"id":{"type":"string","pattern":"^kagawa-extended-plan-evidence-part-[1-3]$"},"prefecture_code":{"const":"37"},"packet_count":{"const":45},"packets":{"type":"array","minItems":45,"maxItems":45,"items":{"$ref":"#/$defs/packet"}},"updated_at":{"type":"string","format":"date"}},"$defs":{"packet":{"type":"object","additionalProperties":false,"required":["id","subject_id","source_url","source_pdf_page","source_table_row","claims","review_status"],"properties":{"id":{"type":"string","pattern":"^kagawa-plan-evidence-[0-9]{3}$"},"subject_id":{"type":"string","pattern":"^kagawa-plan-indicator-[0-9]{3}$"},"source_url":{"type":"string","format":"uri"},"source_pdf_page":{"type":"integer","minimum":3,"maximum":17},"source_table_row":{"type":"integer","minimum":1},"claims":{"type":"array","minItems":4,"maxItems":4,"items":{"type":"object","additionalProperties":false,"required":["field","value_original"],"properties":{"field":{"enum":["indicator_name","current_value","target_r7","target_r8"]},"value_original":{"type":"string","minLength":1}}}},"review_status":{"const":"reviewed"}}}}}