{"id":"kagawa-extended-plan-evidence-part-3","prefecture_code":"37","packet_count":45,"packets":[{"id":"kagawa-plan-evidence-091","subject_id":"kagawa-plan-indicator-091","source_url":"https://www.pref.kagawa.lg.jp/documents/36520/shiryou3_shihyouminaoshi.pdf","source_pdf_page":12,"source_table_row":6,"claims":[{"field":"indicator_name","value_original":"県の就職支援策における 就職件数〔累計〕"},{"field":"current_value","value_original":"3,913件 （H28～R2 年度）"},{"field":"target_r7","value_original":"4,000件 （R3～7年度）"},{"field":"target_r8","value_original":"4,800件 （R3～8年度）"}],"review_status":"reviewed"},{"id":"kagawa-plan-evidence-092","subject_id":"kagawa-plan-indicator-092","source_url":"https://www.pref.kagawa.lg.jp/documents/36520/shiryou3_shihyouminaoshi.pdf","source_pdf_page":12,"source_table_row":8,"claims":[{"field":"indicator_name","value_original":"「かがわ働き方改革推進 宣言」登録企業数〔累計〕"},{"field":"current_value","value_original":"191社 （H30～R2 年度）"},{"field":"target_r7","value_original":"300社 （R3～7年度）"},{"field":"target_r8","value_original":"360社 （R3～8年度）"}],"review_status":"reviewed"},{"id":"kagawa-plan-evidence-093","subject_id":"kagawa-plan-indicator-093","source_url":"https://www.pref.kagawa.lg.jp/documents/36520/shiryou3_shihyouminaoshi.pdf","source_pdf_page":12,"source_table_row":12,"claims":[{"field":"indicator_name","value_original":"外国人労働人材関係相 談窓口での相談件数〔累 計〕"},{"field":"current_value","value_original":"187件 （R3～4年度）"},{"field":"target_r7","value_original":"481件 （R3～7年度）"},{"field":"target_r8","value_original":"586件 （R3～8年度）"}],"review_status":"reviewed"},{"id":"kagawa-plan-evidence-094","subject_id":"kagawa-plan-indicator-094","source_url":"https://www.pref.kagawa.lg.jp/documents/36520/shiryou3_shihyouminaoshi.pdf","source_pdf_page":12,"source_table_row":13,"claims":[{"field":"indicator_name","value_original":"外国人労働者数"},{"field":"current_value","value_original":"10,274人"},{"field":"target_r7","value_original":"15,579人"},{"field":"target_r8","value_original":"17,931人"}],"review_status":"reviewed"},{"id":"kagawa-plan-evidence-095","subject_id":"kagawa-plan-indicator-095","source_url":"https://www.pref.kagawa.lg.jp/documents/36520/shiryou3_shihyouminaoshi.pdf","source_pdf_page":13,"source_table_row":2,"claims":[{"field":"indicator_name","value_original":"かがわ外国人相談支援セ ンターにおける相談支援件 数〔累計〕"},{"field":"current_value","value_original":"871件 （R3～4年度）"},{"field":"target_r7","value_original":"2,459件 （R3～7年度）"},{"field":"target_r8","value_original":"3,063件 （R3～8年度）"}],"review_status":"reviewed"},{"id":"kagawa-plan-evidence-096","subject_id":"kagawa-plan-indicator-096","source_url":"https://www.pref.kagawa.lg.jp/documents/36520/shiryou3_shihyouminaoshi.pdf","source_pdf_page":13,"source_table_row":3,"claims":[{"field":"indicator_name","value_original":"香川国際交流会館（アイ パル香川）利用者数 〔累計〕"},{"field":"current_value","value_original":"264,461人 （R3～4年度）"},{"field":"target_r7","value_original":"700,000人 （R3～7年度）"},{"field":"target_r8","value_original":"840,000人 （R3～8年度）"}],"review_status":"reviewed"},{"id":"kagawa-plan-evidence-097","subject_id":"kagawa-plan-indicator-097","source_url":"https://www.pref.kagawa.lg.jp/documents/36520/shiryou3_shihyouminaoshi.pdf","source_pdf_page":13,"source_table_row":5,"claims":[{"field":"indicator_name","value_original":"温室効果ガス削減率（対 H25年度）"},{"field":"current_value","value_original":"▲24.4％ （R2年度）"},{"field":"target_r7","value_original":"▲33％"},{"field":"target_r8","value_original":"▲35.6％"}],"review_status":"reviewed"},{"id":"kagawa-plan-evidence-098","subject_id":"kagawa-plan-indicator-098","source_url":"https://www.pref.kagawa.lg.jp/documents/36520/shiryou3_shihyouminaoshi.pdf","source_pdf_page":13,"source_table_row":6,"claims":[{"field":"indicator_name","value_original":"「脱炭素に向けたライフス タイル等の転換」を意識し た県民行動の定着度"},{"field":"current_value","value_original":"67.2％ （R5.6現在）"},{"field":"target_r7","value_original":"90％"},{"field":"target_r8","value_original":"90％"}],"review_status":"reviewed"},{"id":"kagawa-plan-evidence-099","subject_id":"kagawa-plan-indicator-099","source_url":"https://www.pref.kagawa.lg.jp/documents/36520/shiryou3_shihyouminaoshi.pdf","source_pdf_page":13,"source_table_row":7,"claims":[{"field":"indicator_name","value_original":"一般廃棄物の最終処分量"},{"field":"current_value","value_original":"2.6万t （R3年度）"},{"field":"target_r7","value_original":"2.6万t"},{"field":"target_r8","value_original":"2.3万t"}],"review_status":"reviewed"},{"id":"kagawa-plan-evidence-100","subject_id":"kagawa-plan-indicator-100","source_url":"https://www.pref.kagawa.lg.jp/documents/36520/shiryou3_shihyouminaoshi.pdf","source_pdf_page":13,"source_table_row":8,"claims":[{"field":"indicator_name","value_original":"産業廃棄物の最終処分量"},{"field":"current_value","value_original":"14.7万t （R3年度）"},{"field":"target_r7","value_original":"16.1万t"},{"field":"target_r8","value_original":"11.4万t"}],"review_status":"reviewed"},{"id":"kagawa-plan-evidence-101","subject_id":"kagawa-plan-indicator-101","source_url":"https://www.pref.kagawa.lg.jp/documents/36520/shiryou3_shihyouminaoshi.pdf","source_pdf_page":13,"source_table_row":9,"claims":[{"field":"indicator_name","value_original":"生物多様性に関する県民 の認知度"},{"field":"current_value","value_original":"42.0％ （R5.6現在）"},{"field":"target_r7","value_original":"50％"},{"field":"target_r8","value_original":"50％"}],"review_status":"reviewed"},{"id":"kagawa-plan-evidence-102","subject_id":"kagawa-plan-indicator-102","source_url":"https://www.pref.kagawa.lg.jp/documents/36520/shiryou3_shihyouminaoshi.pdf","source_pdf_page":13,"source_table_row":10,"claims":[{"field":"indicator_name","value_original":"生物多様性の保全に向け て県と連携した事業者・民 間団体数"},{"field":"current_value","value_original":"7団体 （R3～4年度）"},{"field":"target_r7","value_original":"15団体"},{"field":"target_r8","value_original":"15団体"}],"review_status":"reviewed"},{"id":"kagawa-plan-evidence-103","subject_id":"kagawa-plan-indicator-103","source_url":"https://www.pref.kagawa.lg.jp/documents/36520/shiryou3_shihyouminaoshi.pdf","source_pdf_page":13,"source_table_row":11,"claims":[{"field":"indicator_name","value_original":"汚水処理人口普及率"},{"field":"current_value","value_original":"81.1％"},{"field":"target_r7","value_original":"85％"},{"field":"target_r8","value_original":"85％"}],"review_status":"reviewed"},{"id":"kagawa-plan-evidence-104","subject_id":"kagawa-plan-indicator-104","source_url":"https://www.pref.kagawa.lg.jp/documents/36520/shiryou3_shihyouminaoshi.pdf","source_pdf_page":13,"source_table_row":12,"claims":[{"field":"indicator_name","value_original":"生活環境の向上（大気・ 水・騒音の満足度）"},{"field":"current_value","value_original":"59.3％ （R5.6現在）"},{"field":"target_r7","value_original":"62％"},{"field":"target_r8","value_original":"62％"}],"review_status":"reviewed"},{"id":"kagawa-plan-evidence-105","subject_id":"kagawa-plan-indicator-105","source_url":"https://www.pref.kagawa.lg.jp/documents/36520/shiryou3_shihyouminaoshi.pdf","source_pdf_page":13,"source_table_row":13,"claims":[{"field":"indicator_name","value_original":"環境保全活動や環境学習 講座等への参加状況"},{"field":"current_value","value_original":"39.7％ （R5.6現在）"},{"field":"target_r7","value_original":"40％"},{"field":"target_r8","value_original":"40％"}],"review_status":"reviewed"},{"id":"kagawa-plan-evidence-106","subject_id":"kagawa-plan-indicator-106","source_url":"https://www.pref.kagawa.lg.jp/documents/36520/shiryou3_shihyouminaoshi.pdf","source_pdf_page":13,"source_table_row":14,"claims":[{"field":"indicator_name","value_original":"県と連携した市町・事業 者・民間団体数"},{"field":"current_value","value_original":"89団体"},{"field":"target_r7","value_original":"94団体"},{"field":"target_r8","value_original":"100団体"}],"review_status":"reviewed"},{"id":"kagawa-plan-evidence-107","subject_id":"kagawa-plan-indicator-107","source_url":"https://www.pref.kagawa.lg.jp/documents/36520/shiryou3_shihyouminaoshi.pdf","source_pdf_page":14,"source_table_row":2,"claims":[{"field":"indicator_name","value_original":"犬猫の殺処分数"},{"field":"current_value","value_original":"犬 293頭 猫 243匹 （R3年度）"},{"field":"target_r7","value_original":"犬 25％減 猫 10％減 （R2年度比）"},{"field":"target_r8","value_original":"犬 30％減 猫 12％減 （R2年度比）"}],"review_status":"reviewed"},{"id":"kagawa-plan-evidence-108","subject_id":"kagawa-plan-indicator-108","source_url":"https://www.pref.kagawa.lg.jp/documents/36520/shiryou3_shihyouminaoshi.pdf","source_pdf_page":14,"source_table_row":4,"claims":[{"field":"indicator_name","value_original":"みどりの豊かさ（森林・公園 など）の満足度"},{"field":"current_value","value_original":"63％ （R5.6現在）"},{"field":"target_r7","value_original":"65％"},{"field":"target_r8","value_original":"67％"}],"review_status":"reviewed"},{"id":"kagawa-plan-evidence-109","subject_id":"kagawa-plan-indicator-109","source_url":"https://www.pref.kagawa.lg.jp/documents/36520/shiryou3_shihyouminaoshi.pdf","source_pdf_page":14,"source_table_row":5,"claims":[{"field":"indicator_name","value_original":"公園・緑地面積"},{"field":"current_value","value_original":"1,842ha →1,817ha （R3年度）"},{"field":"target_r7","value_original":"1,856ha →1,831ha （R6年度）"},{"field":"target_r8","value_original":"1,831ha （R7年度）"}],"review_status":"reviewed"},{"id":"kagawa-plan-evidence-110","subject_id":"kagawa-plan-indicator-110","source_url":"https://www.pref.kagawa.lg.jp/documents/36520/shiryou3_shihyouminaoshi.pdf","source_pdf_page":14,"source_table_row":6,"claims":[{"field":"indicator_name","value_original":"森林ボランティア活動の関 心度"},{"field":"current_value","value_original":"64％ （R5.6現在）"},{"field":"target_r7","value_original":"65％"},{"field":"target_r8","value_original":"65％"}],"review_status":"reviewed"},{"id":"kagawa-plan-evidence-111","subject_id":"kagawa-plan-indicator-111","source_url":"https://www.pref.kagawa.lg.jp/documents/36520/shiryou3_shihyouminaoshi.pdf","source_pdf_page":14,"source_table_row":8,"claims":[{"field":"indicator_name","value_original":"立地適正化計画区域内の 人口"},{"field":"current_value","value_original":"752千人"},{"field":"target_r7","value_original":"760千人"},{"field":"target_r8","value_original":"778千人"}],"review_status":"reviewed"},{"id":"kagawa-plan-evidence-112","sub